{
  "id": "br.sc.coastal.midrise.v1",
  "version": "1.0.0",
  "scope": {
    "country": "BRA",
    "state": "SC",
    "biome": "atlantic_forest_coastal",
    "region_type": "coastal_residential_mixed"
  },
  "architecture": {
    "building_mix": {
      "detached_house": 0.3,
      "townhouse": 0.12,
      "lowrise_multifamily": 0.3,
      "midrise_multifamily": 0.23,
      "commercial_lowrise": 0.05
    },
    "floor_ranges": {
      "detached_house": [
        1,
        2
      ],
      "townhouse": [
        2,
        3
      ],
      "lowrise_multifamily": [
        2,
        4
      ],
      "midrise_multifamily": [
        4,
        8
      ],
      "commercial_lowrise": [
        1,
        3
      ]
    },
    "setbacks_m": {
      "front": [
        2.0,
        5.0
      ],
      "side": [
        0.0,
        2.0
      ],
      "rear": [
        1.5,
        4.0
      ]
    },
    "lot_coverage_range": [
      0.3,
      0.72
    ],
    "wall_probability": 0.48
  },
  "roofs": {
    "types": {
      "gable": 0.3,
      "hip": 0.18,
      "flat": 0.42,
      "shed": 0.1
    },
    "pitch_deg": [
      15,
      36
    ],
    "eave_m": [
      0.25,
      0.85
    ],
    "materials": {
      "ceramic": 0.3,
      "metal": 0.3,
      "fiber_cement": 0.16,
      "membrane": 0.24
    }
  },
  "facades": {
    "palette": [
      "#EEECE6",
      "#DCD7CC",
      "#C5C7C4",
      "#A69E90",
      "#6B6A66",
      "#786C5A"
    ],
    "materials": {
      "render": 0.45,
      "painted_masonry": 0.2,
      "concrete": 0.12,
      "wood_accent": 0.12,
      "stone_accent": 0.06,
      "glass": 0.05
    },
    "window_ratios": {
      "residential": 0.3,
      "commercial": 0.55
    },
    "balcony_probability": 0.58
  },
  "vegetation": {
    "biome_profile": "atlantic_forest_coastal",
    "street_tree_density": [
      0.05,
      0.22
    ],
    "lot_green_ratio": [
      0.12,
      0.45
    ]
  },
  "roads": {
    "local_width_m": [
      5.0,
      8.0
    ],
    "sidewalk_width_m": [
      1.0,
      2.2
    ],
    "curb_height_m": [
      0.1,
      0.18
    ]
  },
  "metadata": {
    "source": "ARCZ curated procedural preset; must be refined with licensed local evidence",
    "confidence": 0.55,
    "license": "MIT OR Apache-2.0",
    "notes": [
      "Não substitui cadastro, código de obras ou levantamento de campo."
    ]
  }
}
